<xs:schema attributeFormDefault="unqualified" elementFormDefault="qualified" xmlns:xs="http://www.w3.org/2001/XMLSchema">
    <xs:element name="content">
        <xs:annotation>
            <xs:documentation>&lt;content  xmlns:xsi="http://www.w3.org/2001/XMLSchema-instance" xsi:noNamespaceSchemaLocation="persons.xsd"></xs:documentation>
        </xs:annotation>
        <xs:complexType>
            <xs:sequence>
                <xs:element name="person">
                    <xs:complexType>
                        <xs:sequence>
                            <xs:element type="xs:byte" name="person_id"/>
                            <xs:element type="xs:string" name="first_name"/>
                            <xs:element type="xs:string" name="last_name"/>
                            <xs:element name="address">
                                <xs:complexType>
                                    <xs:sequence>
                                        <xs:element type="xs:string" name="street"/>
                                        <xs:element type="xs:int" name="zip_code"/>
                                        <xs:element type="xs:byte" name="house_number"/>
                                        <xs:element type="xs:string" name="city"/>
                                        <xs:element type="xs:string" name="country"/>
                                    </xs:sequence>
                                </xs:complexType>
                            </xs:element>
                            <xs:element name="group">
                                <xs:complexType>
                                    <xs:sequence>
                                        <xs:element type="xs:string" name="name"/>
                                        <xs:element name="roles">
                                            <xs:complexType>
                                                <xs:sequence>
                                                    <xs:element type="xs:string" name="role"/>
                                                </xs:sequence>
                                            </xs:complexType>
                                        </xs:element>
                                    </xs:sequence>
                                </xs:complexType>
                            </xs:element>
                        </xs:sequence>
                        <xs:attribute type="xs:string" name="state"/>
                    </xs:complexType>
                </xs:element>
            </xs:sequence>
        </xs:complexType>
    </xs:element>
</xs:schema>